Headline,Author,Source,Published Date,News Url
APT37 hackers use new malware to breach air-gapped networks,Bill Toulas,BleepingComputer,2026-02-27 07:21 PM,https://www.bleepingcomputer.com/news/security/apt37-hackers-use-new-malware-to-breach-air-gapped-networks/
Tetzaveh: Moses and the priestly garments,Israel National News,Israelnationalnews.com,2026-02-27 09:31 AM,https://www.israelnationalnews.com/news/423084
"A good, hard look at the state of black-Jewish relations in America",David Christopher Kaufman,Israelnationalnews.com,2026-02-27 05:00 AM,https://www.israelnationalnews.com/news/423072
Garments of Glory,"Rabbi Reuven Mann, ZT""L",Israelnationalnews.com,2026-02-27 05:55 AM,https://www.israelnationalnews.com/news/423075
US Strikes On Iran Imminent: Key Signs,Newsweek,Freerepublic.com,2026-02-27 07:16 PM,https://freerepublic.com/focus/f-news/4368575/posts
How the CDU aims to tighten Germany's citizenship rules in 2026,Paul Krantz,The Local Germany,2026-02-27 02:13 PM,https://www.thelocal.de/20260227/how-the-cdu-aims-to-tighten-germanys-citizenship-rules-in-2026
Ari Emanuel went on buying spree at his celebrity packed Frieze Los Angeles art fair,mliss1578,Page Six,2026-02-27 02:48 PM,https://pagesix.com/2026/02/27/hollywood/ari-emanuel-went-on-buying-spree-at-his-celebrity-packed-frieze-los-angeles-art-fair/
"The News Roundup For February 27, 2026",NPR,NPR,2026-02-27 08:55 PM,https://www.npr.org/2026/02/27/nx-s1-5729464/the-news-roundup-for-february-27-2026
Rubio designates Iran a state sponsor of wrongful detention,,Israelnationalnews.com,2026-02-27 09:31 PM,https://www.israelnationalnews.com/flashes/677173
Table no 8 and a first date: Benjamin Netanyahu reveals how an Indian restaurant 'Tandoori Tel Aviv' played cupid for Israel PM and his wife Sarah,Trending Desk,The Times of India,2026-02-27 10:06 AM,https://economictimes.indiatimes.com/news/new-updates/table-no-8-and-a-first-date-benjamin-netanyahu-reveals-how-an-indian-restaurant-tandoori-tel-aviv-played-cupid-for-israel-pm-and-his-wife-sarah/articleshow/128844011.cms
US and Iran wrap up latest nuclear talks without a deal as the risk of war looms,AP,The Times of India,2026-02-27 03:22 AM,https://economictimes.indiatimes.com/news/international/global-trends/us-and-iran-wrap-up-latest-nuclear-talks-without-a-deal-as-the-risk-of-war-looms/articleshow/128835823.cms
"With Possible Iran Strike Looming, U.S. Says Staff Can Leave Israel, Urging Speed",New York Times,Freerepublic.com,2026-02-27 12:21 PM,https://freerepublic.com/focus/f-chat/4368504/posts
"Iran says 'good progress' in US talks, next round within a week",hurriyetdailynews.com,Hurriyet Daily News,2026-02-27 06:07 AM,https://www.hurriyetdailynews.com/iran-says-good-progress-in-us-talks-next-round-within-a-week-219368
Countercurrents,Selma Dabbagh,London Review of Books,2026-02-27 11:52 AM,https://www.lrb.co.uk/blog/2026/february/countercurrents
Mirwaiz Umar Farooq urges Pakistan-Afghanistan dialogue,Hakeem Irfan Rashid,The Times of India,2026-02-27 07:24 PM,https://economictimes.indiatimes.com/news/india/mirwaiz-umar-farooq-urges-pakistan-afghanistan-dialogue/articleshow/128863840.cms
World Bank faces calls to fire Israel-bashing top economist who sued Trump over sanctions against his wife,James Franey,New York Post,2026-02-27 09:35 PM,https://nypost.com/2026/02/27/business/world-bank-faces-calls-to-fire-israel-bashing-top-economist-who-sued-trump-over-sanctions-against-his-wife/
IDF Spokesperson reassures Israelis amid rising tensions,,Israelnationalnews.com,2026-02-27 06:43 PM,https://www.israelnationalnews.com/flashes/677168
"Omani FM Cites 'Significant Progress' As US, Iran Conclude Fresh Round Of Nuclear Talks",John Pike,Globalsecurity.org,2026-02-27 10:11 AM,https://www.globalsecurity.org/wmd/library/news/iran/2026/02/iran-260226-rferl02.htm
Rubio to visit Israel amid growing tensions with Iran,,Israelnationalnews.com,2026-02-27 08:59 PM,https://www.israelnationalnews.com/flashes/677171
AIPAC faces test of its power in Illinois primary as Democrats debate future of Israel relationship,"Leah Askarinam, Associated Press, Maya Sweedler, Associated Press, Matt Brown, Associated Press",PBS,2026-02-27 03:22 PM,https://www.pbs.org/newshour/politics/aipac-faces-test-of-its-power-in-illinois-primary-as-democrats-debate-future-of-israel-relationship
Rubio plans to visit Israel next week as U.S.-Iran tensions remain high after latest talks,"Sam Mednick, Associated Press, Sam Metz, Associated Press, Matthew Lee, Associated Press",PBS,2026-02-27 05:14 PM,https://www.pbs.org/newshour/world/rubio-plans-to-visit-israel-next-week-as-u-s-iran-tensions-remain-high-after-latest-talks
Iran and US compromise over nuclear stockpile - but Trump's window for action grows smaller,Alistair Bunkall,Sky.com,2026-02-27 06:35 AM,https://news.sky.com/story/iran-and-us-compromise-over-nuclear-stockpile-but-trumps-window-for-action-grows-smaller-by-the-day-13512828
In defense of de-platforming Zionists on college campuses,Tarik Aougab,Mondoweiss,2026-02-27 12:00 PM,https://mondoweiss.net/2026/02/in-defense-of-de-platforming-zionists-on-college-campuses/
"Trump says he'd 'love not to' attack Iran, 'but sometimes you have to'",Dan Mangan,CNBC,2026-02-27 06:17 PM,https://www.cnbc.com/2026/02/27/trump-iran-war.html
Hacker Used Anthropic’s Claude to Steal Mexican Data Trove,Admin,Insurance Journal,2026-02-27 06:05 AM,https://www.insurancejournal.com/news/international/2026/02/27/859786.htm
JEE Mains 2026 correction window to open today: Check details here,TOI Education,The Times of India,2026-02-27 02:37 AM,https://timesofindia.indiatimes.com/education/news/jee-mains-2026-correction-window-to-open-today-check-details-here/articleshow/128835107.cms
UK withdraws Tehran embassy staff as concern grows over threat of US strikes,BBC,Freerepublic.com,2026-02-27 04:47 PM,https://freerepublic.com/focus/f-news/4368545/posts
Eshaa Pathak: Verticals are more hectic than TV shows,Neha Maheshwri,The Times of India,2026-02-27 04:37 PM,https://timesofindia.indiatimes.com/tv/news/hindi/eshaa-pathak-verticals-are-more-hectic-than-tv-shows/articleshow/128858947.cms
What’s at stake in U.S.-Iran nuclear talks? #world,AllToc,Alltoc.com,2026-02-27 09:12 PM,https://alltoc.com/world/whats-at-stake-in-u-s-iran-nuclear-talks
"'Uttarakhand is a sentiment, not just a state’: Dr Kumar Vishwas at Uttarakhand Transformation Dialogues",TIMESOFINDIA.COM,The Times of India,2026-02-27 04:46 PM,https://timesofindia.indiatimes.com/india/uttarakhand-is-a-sentiment-not-just-a-state-dr-kumar-vishwas-at-uttarakhand-transformation-dialogues/articleshow/128859524.cms
What is the state of U.S.-Iran talks and military buildup? #politics,AllToc,Alltoc.com,2026-02-27 09:08 PM,https://alltoc.com/politics/what-is-the-state-of-u-s-iran-talks-and-military-buildup
Trump says he's 'not happy' with Iran talks but will wait to see what happens in further rounds,"Sam Mednick, Associated Press, Sam Metz, Associated Press, Matthew Lee, Associated Press",PBS,2026-02-27 07:06 PM,https://www.pbs.org/newshour/world/trump-says-hes-not-happy-with-iran-talks-but-will-wait-to-see-what-happens-in-further-rounds
IAEA report highlights lack of access to Iran's nuclear sites after war,,Israelnationalnews.com,2026-02-27 08:15 PM,https://www.israelnationalnews.com/flashes/677170
'Peace is within reach': Omani FM optimistic after meeting US VP JD Vance,,Israelnationalnews.com,2026-02-27 09:24 PM,https://www.israelnationalnews.com/flashes/677172
Trump: Iran is ‘not going far enough’ in nuclear negotiations,,Israelnationalnews.com,2026-02-27 09:39 PM,https://www.israelnationalnews.com/flashes/677174
XTL Announces Receipt of Staff Delist Determination from Nasdaq and Plans to Request Hearing,XTL Biopharmaceuticals Ltd.,GlobeNewswire,2026-02-27 09:30 PM,https://www.globenewswire.com/news-release/2026/02/27/3246813/0/en/XTL-Announces-Receipt-of-Staff-Delist-Determination-from-Nasdaq-and-Plans-to-Request-Hearing.html
US Embassy announces evacuation of non-essential employees and family members,,Israelnationalnews.com,2026-02-27 09:36 AM,https://www.israelnationalnews.com/flashes/677150
"Trump on Iran strike: I don't want to, but sometimes you have to",,Israelnationalnews.com,2026-02-27 06:01 PM,https://www.israelnationalnews.com/flashes/677167
"PM Modi flags capex climb to ₹12 lakh crore in a decade, ties infra push to long-term growth",ET Online,The Times of India,2026-02-27 06:28 AM,https://economictimes.indiatimes.com/news/politics-and-nation/pm-modi-flags-capex-climb-to-12-lakh-crore-in-a-decade-ties-infra-push-to-long-term-growth/articleshow/128838999.cms
Pressure on for 40 EU presidency meetings security as clash with Trump visit and sporting events,Niall O'Connor,TheJournal.ie,2026-02-27 12:05 AM,https://www.thejournal.ie/security-operation-garda-defence-forces-eu-presidency-drones-dublin-summit-6968388-Feb2026/
Here's What Happened Today: Friday,Diarmuid Pepper,TheJournal.ie,2026-02-27 08:44 PM,https://www.thejournal.ie/news-fix-friday-february-3-6970215-Feb2026/
Embassies Evacuate in Mideast With Trump ‘Not Happy’ On Iran,Bloomberg News,Financial Post,2026-02-27 06:41 PM,https://financialpost.com/pmn/business-pmn/embassies-evacuate-in-mideast-with-trump-not-happy-on-iran
Iran Seen Conducting Regular Activity at Bombed Enrichment Sites,Bloomberg News,Financial Post,2026-02-27 02:31 PM,https://financialpost.com/pmn/business-pmn/iran-seen-conducting-regular-activity-at-bombed-enrichment-sites
"CM Shri School admissions 2026: Registration begins for Classes 6, 9 and 11; direct link to apply here",TOI Education,The Times of India,2026-02-27 04:38 AM,https://timesofindia.indiatimes.com/education/news/cm-shri-school-admissions-2026-registration-begins-for-classes-6-9-and-11-direct-link-to-apply-here/articleshow/128836972.cms
Dipika Kakar returns home after cyst removal surgery; breaks down emotionally thanking fans ‘Ruhaan ki mummy jaldi theek hojaaye’,etimes.in,The Times of India,2026-02-27 04:53 AM,https://timesofindia.indiatimes.com/tv/news/hindi/dipika-kakar-returns-home-after-cyst-removal-surgery-breaks-down-emotionally-thanking-fans-ruhaan-ki-mummy-jaldi-theek-hojaaye/articleshow/128837300.cms
It’s pure madness to wait for Iran to get nukes before we act,David Harsanyi,New York Post,2026-02-27 11:41 PM,https://nypost.com/2026/02/27/opinion/its-pure-madness-to-wait-for-iran-to-get-nukes-before-we-act/
"Delhi CM Rekha Gupta slams Kejriwal after excise case discharge, calls 'kattar imandaar' claims ""drama""",ANI,The Times of India,2026-02-27 05:15 PM,https://timesofindia.indiatimes.com/india/delhi-cm-rekha-gupta-slams-kejriwal-after-excise-case-discharge-calls-kattar-imandaar-claims-drama/articleshow/128860038.cms
"Boy George could be set for Eurovision 2026 finals, but not representing UK",Chantelle Billson,Thepinknews.com,2026-02-27 10:54 AM,https://www.thepinknews.com/2026/02/27/boy-george-could-be-set-for-eurovision-2026-finals-but-not-representing-uk/
"'My seat was stolen': Cori Bush formally files bid to reclaim seat, blasts AIPAC",,Israelnationalnews.com,2026-02-27 09:57 PM,https://www.israelnationalnews.com/flashes/677175
IDF eliminates terrorists who emerged from a terror tunnel in Rafah,,Israelnationalnews.com,2026-02-27 10:57 AM,https://www.israelnationalnews.com/flashes/677152
"Trump Iranian missile claim unsupported by US intelligence, say sources",Reuters,BusinessLine,2026-02-27 04:56 AM,https://www.thehindubusinessline.com/news/world/trump-iranian-missile-claim-unsupported-by-us-intelligence-say-sources/article70682665.ece
"Israel’s ‘expansionist mindset’ bereft of any regard for international law, Pakistani Foreign Minister Dar tells OIC (Organization of Islamic Countries)",Dawn Pakistan,Freerepublic.com,2026-02-27 09:19 AM,https://freerepublic.com/focus/f-news/4368489/posts
"Israel’s ‘expansionist mindset’ bereft of any regard for international law, Pakistani Foreign Minister Dar tells OIC (Organization of Islamic Countries)",Dawn Pakistan,Freerepublic.com,2026-02-27 09:19 AM,https://freerepublic.com/focus/f-bloggers/4368489/posts
"John Piper prompts pushback from Jack Hibbs, others over Leviticus tweet on ""welcoming the stranger"": 'Irresponsible theology'",Christian Post,Freerepublic.com,2026-02-27 12:59 AM,https://freerepublic.com/focus/f-religion/4368466/posts
Early Sales at Frieze L.A. Signal Renewed Collector Confidence,"Jordan Riefe, Jordan Riefe",Observer,2026-02-27 05:54 PM,https://observer.com/2026/02/frieze-los-angeles-2026-sales-report-best-booths-la-exhibitions/
Is the US preparing to strike Iran again? Latest developments on Iran war fears,Piyush Shukla,The Times of India,2026-02-27 02:19 PM,https://economictimes.indiatimes.com/news/international/us/is-the-us-preparing-to-strike-iran-again-latest-developments-on-iran-war-fears/articleshow/128854393.cms
Are tanks in urban warfare a burden or benefit?,Isegoria,Isegoria.net,2026-02-27 06:43 PM,https://www.isegoria.net/2026/02/are-tanks-in-urban-warfare-a-burden-or-benefit/
"Rubio to travel to Israel to discuss Iran, other issues, State Dept. says",Dan Mangan,CNBC,2026-02-27 03:59 PM,https://www.cnbc.com/2026/02/27/iran-israel-rubio-state-department.html
Israelis No Longer Ahead in Americans' Middle East Sympathies,Benedict Vigers,Gallup.com,2026-02-27 09:00 AM,https://news.gallup.com/poll/702440/israelis-no-longer-ahead-americans-middle-east-sympathies.aspx
Trump Said We ‘Obliterated’ Iran’s Nuclear Program Last June. So Why Are We About To Go War?,The Federalist,Freerepublic.com,2026-02-27 05:25 PM,https://freerepublic.com/focus/f-news/4368552/posts
Tether says it has frozen $4.2 billion of its stablecoin over crime links,Reuters,The Times of India,2026-02-27 03:36 PM,https://economictimes.indiatimes.com/tech/technology/tether-says-it-has-frozen-4-2-billion-of-its-stablecoin-over-crime-links/articleshow/128854965.cms
‘Unprecedented and without parallel’ – Ivana Bacik hails Michael D and Sabina Higgins for contribution to Irish society,Eavan Murray,Independent.ie,2026-02-27 09:57 PM,https://www.independent.ie/irish-news/unprecedented-and-without-parallel-ivana-bacik-hails-michael-d-and-sabina-higgins-for-contribution-to-irish-society/a2031990780.html
"New Shows & Movies To Watch This Weekend: ‘Scrubs’ on Hulu, ‘The Traitors’ Finale on Peacock + More",mliss1578,Decider,2026-02-27 01:00 PM,https://decider.com/2026/02/27/new-shows-movies-to-watch-this-weekend-scrubs-on-hulu-the-traitors-finale-on-peacock-more/
This Year’s Oscar Documentaries Are Tough to Watch,Jordan Hoffman,Foreign Policy,2026-02-27 07:40 PM,http://foreignpolicy.com/2026/02/27/oscar-documentary-nominees-2026/
Civic chief admits to issuesin waste collection timings in Bengaluru,Sanjay R Murty,The Times of India,2026-02-27 12:07 AM,https://timesofindia.indiatimes.com/city/bengaluru/civic-chief-admits-to-issuesin-waste-collection-timings-in-bengaluru/articleshow/128824216.cms
iQuantiv Brings Billion-Dollar Analytics to the Mid-Market With Sisense,Business Wire,Financial Post,2026-02-27 11:03 AM,https://financialpost.com/pmn/business-wire-news-releases-pmn/iquantiv-brings-billion-dollar-analytics-to-the-mid-market-with-sisense
US opens 'pop-up' consulate in Israeli settlement considered illegal under international law,Adam Parsons,Sky.com,2026-02-27 06:58 PM,https://news.sky.com/story/us-opens-pop-up-consulate-in-israeli-settlement-considered-illegal-under-international-law-13513109
"Why is silver price rising by 6% and will it go above $93.67 to touch $100 in next jump? Silver rise, analysts insights and market outlook explained. Here's what should investors do now",Gandharv Walia,The Times of India,2026-02-27 06:00 PM,https://economictimes.indiatimes.com/news/international/us/why-is-silver-price-rising-by-6-and-will-it-go-above-93-67-to-touch-100-in-next-jump-silver-rise-analysts-insights-and-market-outlook-explained-heres-what-should-investors-do-now/articleshow/128861041.cms
"Navi Mumbai woman falls prey to PNG bill fraud, loses Rs 4.6 lakh",George Mendonca,The Times of India,2026-02-27 12:07 AM,https://timesofindia.indiatimes.com/city/mumbai/navi-mumbai-woman-falls-prey-to-png-bill-fraud-loses-rs-4-6-lakh/articleshow/128824230.cms
Will We Attack Iran This Afternoon - Greg Kelly Has Heard,Greg Kelly Show,Freerepublic.com,2026-02-27 07:16 PM,https://freerepublic.com/focus/f-chat/4368574/posts
DANIEL HANNAN: What a frightening - and toxic - new world Britain just woke up to. The Greens are poison...[Gorton and Denton by-election] [ed],UK Daily Mail,Freerepublic.com,2026-02-27 11:59 AM,https://freerepublic.com/focus/f-news/4368500/posts
UN nuclear watchdog says it's unable to verify whether Iran has suspended all uranium enrichment,"Stephanie Liechtenstein, Associated Press",PBS,2026-02-27 05:42 PM,https://www.pbs.org/newshour/world/un-nuclear-watchdog-says-its-unable-to-verify-whether-iran-has-suspended-all-uranium-enrichment
What Did You Think of Scream 7?,Cody Hamman,JoBlo.com,2026-02-27 09:29 PM,https://www.joblo.com/what-did-you-think-of-scream-7/
"Dow Jones free fall today: Why did the Dow crash 800 points — inflation shock, Iran war fear and AI disruption slam US stock market on the last February trading day",Piyush Shukla,The Times of India,2026-02-27 03:19 PM,https://economictimes.indiatimes.com/news/international/us/dow-jones-free-fall-today-why-did-the-dow-crash-800-points-inflation-shock-iran-war-fear-and-ai-disruption-slam-us-stock-market-on-the-last-february-trading-day/articleshow/128856605.cms
Ads funded by AI industry are flooding the 2026 election. They're about everything except AI.,Ben Kamisar,NBC News,2026-02-27 05:37 PM,https://www.nbcnews.com/politics/2026-election/ads-ai-industry-are-flooding-2026-election-artificial-intelligence-rcna260782
"In first, Israelis no longer ahead of Palestinians in U.S. sympathies, poll shows",Linda Dayan,Haaretz,2026-02-27 09:04 AM,https://www.haaretz.com/us-news/2026-02-27/ty-article/.premium/in-first-israelis-no-longer-ahead-of-palestinians-in-u-s-sympathy-poll-shows/0000019c-9b3d-d5d1-a1fd-db3ffeec0000
Inside the Israel Museum's crisis: From Jerusalem's crown jewel to an institution on the brink,Naama Riba,Haaretz,2026-02-27 06:57 AM,https://www.haaretz.com/israel-news/culture/2026-02-27/ty-article-magazine/.highlight/informants-manipulation-power-hungry-rule-inside-the-israel-museums-crisis/0000019c-98b5-df87-a5bf-dfff8a7c0000
U.S. embassy authorizes staff to depart from Israel citing 'safety risks',Reuters,Haaretz,2026-02-27 09:39 AM,https://www.haaretz.com/middle-east-news/iran/2026-02-27/ty-article/u-s-embassy-authorizes-staff-to-depart-from-israel-citing-safety-risks/0000019c-9e07-d981-a1be-9ebf2ffb0000
Israel exempts U.S. immigrants with American jobs from national insurance payments,Efrat Neuman,Haaretz,2026-02-27 05:01 PM,https://www.haaretz.com/israel-news/israel-politics/2026-02-27/ty-article/.premium/american-immigrants-to-israel-with-u-s-jobs-exempted-from-national-insurance/0000019c-9ecf-d981-a1be-9eff6da30000
Ben-Gvir presses Israel Police for mass criminal restriction orders despite lack of intel,Josh Breiner,Haaretz,2026-02-27 12:16 PM,https://www.haaretz.com/israel-news/2026-02-27/ty-article/.premium/ben-gvir-presses-police-for-mass-crime-restriction-orders-despite-lack-of-intel/0000019c-9bc1-d88a-af9e-dbf3e08a0000
"Israel Police, IDF clash over probe into killing of Palestinian-American teen in West Bank",Matan Golan,Haaretz,2026-02-27 01:29 PM,https://www.haaretz.com/israel-news/israel-security/2026-02-27/ty-article/.premium/police-idf-clash-over-probe-into-palestinian-american-teen-killed-in-west-bank/0000019c-9e57-d5d1-a1fd-de77c6b90000
"As court battle continues, foreign journalists launch campaign urging Israel to lift Gaza access ban",Etan Nechin,Haaretz,2026-02-27 09:53 PM,https://www.haaretz.com/gaza/2026-02-27/ty-article/.premium/foreign-journalists-launch-campaign-for-israel-to-end-gaza-access-ban/0000019c-a0a6-d981-a1be-b2be21650000
Trump 'not thrilled' with Iran but undecided on attack,,CNA,2026-02-27 07:31 PM,https://www.channelnewsasia.com/world/trump-us-iran-war-strike-israel-talks-5959511
"Yediyurappa, architect of BJP’s southern breakthrough, turns 84",TNN,The Times of India,2026-02-27 05:14 PM,https://timesofindia.indiatimes.com/city/bengaluru/yediyurappa-architect-of-bjps-southern-breakthrough-turns-84/articleshow/128860320.cms
Except on the other side of the fence,Hanin Majadli,Haaretz,2026-02-27 02:04 AM,https://www.haaretz.com/opinion/2026-02-27/ty-article-opinion/.premium/except-on-the-other-side-of-the-fence/0000019c-9b8a-d981-a1be-9bbad6bb0000
These are Israel's demands of Hamas,Dalit Halevy,Israelnationalnews.com,2026-02-27 01:37 PM,https://www.israelnationalnews.com/news/423091
"Targeting disabled people, West Bank annexation, and what next for WFP? The Cheat Sheet",,The New Humanitarian,2026-02-27 03:19 PM,https://www.thenewhumanitarian.org/news/2026/02/27/targeting-disabled-people-west-bank-annexation-what-next-wfp-cheat-sheet
A new Gallup poll shows how Americans’ sympathies have shifted in the Israeli-Palestinian conflict,The Associated Press,The Denver Post,2026-02-27 01:48 PM,https://www.denverpost.com/2026/02/27/israel-palestine-poll/
Churchill statue in London defaced with anti-Israel messages,,Fox News,2026-02-27 03:44 PM,https://www.foxnews.com/world/churchill-statue-london-defaced-anti-israel-messages
Serbia refuses to cooperate with Israeli authorities on arrest of political adviser to Netanyahu,Gidi Weitz,Haaretz,2026-02-27 04:05 AM,https://www.haaretz.com/israel-news/israel-politics/2026-02-27/ty-article/.premium/serbia-wont-cooperate-with-israel-on-arrest-of-adviser-to-netanyahu/0000019c-9b70-d930-ad9f-fff502e10000
Adam Friedland isn't joking: Israel's war in Gaza 'changed what being Jewish is',Etan Nechin,Haaretz,2026-02-27 01:48 PM,https://www.haaretz.com/life/2026-02-27/ty-article-magazine/.premium/adam-friedland-isnt-joking-israels-war-in-gaza-changed-what-being-jewish-is/0000019c-8f16-dab1-adbe-bf7e93ce0000
"Trump: 'I don't want to use military force against Iran, but sometimes you have to'",Haaretz,Haaretz,2026-02-27 09:44 PM,https://www.haaretz.com/middle-east-news/iran/2026-02-27/ty-article/trump-says-he-doesnt-want-to-strike-iran-but-sometimes-you-have-to/0000019c-a0a2-d5d1-a1fd-f2b60f400000
"Trump: 'I don't want to use military force against Iran, but sometimes you have to'",Haaretz,Haaretz,2026-02-27 09:44 PM,https://www.haaretz.com/middle-east-news/iran/2026-02-27/ty-article/.premium/trump-says-he-doesnt-want-to-strike-iran-but-sometimes-you-have-to/0000019c-a0a2-d5d1-a1fd-f2b60f400000
The Rapture - When the American Dam Breaks What Then America? What Then? (With Images),The Ignorant Fishermen Blog,Freerepublic.com,2026-02-27 02:31 PM,https://freerepublic.com/focus/f-religion/4368527/posts
FRO – Fourth Quarter and Full Year 2025 Results,Frontline plc.,GlobeNewswire,2026-02-27 06:28 AM,https://www.globenewswire.com/news-release/2026/02/27/3246279/0/en/FRO-Fourth-Quarter-and-Full-Year-2025-Results.html
XTEND Debuts Industry-First Multi-Drone Coordination Capability at Disruptors in the Desert 2026,XTEND,GlobeNewswire,2026-02-27 01:30 PM,https://www.globenewswire.com/news-release/2026/02/27/3246503/0/en/XTEND-Debuts-Industry-First-Multi-Drone-Coordination-Capability-at-Disruptors-in-the-Desert-2026.html
Suspect arrested after Churchill statue in London defaced with pro-Palestinian graffiti,Associated Press,Freerepublic.com,2026-02-27 02:59 PM,https://freerepublic.com/focus/f-news/4368533/posts
ZUSDURI™ Achieves Durable Complete Responses Across EORTC Risk Groups in Patients with Recurrent LG-IR-NMIBC,UroGen Pharma Ltd.,GlobeNewswire,2026-02-27 01:30 PM,https://www.globenewswire.com/news-release/2026/02/27/3246510/0/en/ZUSDURI-Achieves-Durable-Complete-Responses-Across-EORTC-Risk-Groups-in-Patients-with-Recurrent-LG-IR-NMIBC.html
'Scream 7' premiere targeted by anti-Israel protesters after actress dropped over controversial posts,,Fox News,2026-02-27 01:07 PM,https://www.foxnews.com/media/scream-7-premiere-targeted-anti-israel-protesters-after-actress-dropped-over-controversial-posts
"Zachary Levi reveals the epic battles, human flaws of King David in new Fox Nation series",,Fox News,2026-02-27 11:13 AM,https://www.foxnews.com/media/zachary-levi-reveals-epic-battles-human-flaws-king-david-new-fox-nation-series
"US positions F-22 stealth fighters in Israel, puts 'almost any target in Iran at risk'",,Fox News,2026-02-27 07:55 PM,https://www.foxnews.com/world/us-positions-f-22-stealth-fighters-israel-puts-almost-any-target-iran-risk
Drug Trials Snapshot: HYRNUO,FDA,FDA.gov,2026-02-27 06:10 PM,https://www.fda.gov/drugs/drug-approvals-and-databases/drug-trials-snapshot-hyrnuo
Why Is the Oil Price Rising Today?,Andreas Exarheas,Rigzone,2026-02-27 03:10 PM,https://www.rigzone.com/news/why_is_the_oil_price_rising_today-27-feb-2026-183093-article/
US Embassy in Israel to Staff: Get Out Now if You Want to Go,Rob Quinn,Newser,2026-02-27 04:08 PM,https://www.newser.com/story/384518/us-embassy-in-israel-to-staff-get-out-now-if-you-want-to-go.html
"With Possible Iran Strike Looming, U.S. Says Staff Can Leave Israel, and Urges Speed - The New York Times - The New York Times",feedfeeder,Slashdot.org,2026-02-27 11:12 AM,https://slashdot.org/firehose.pl?op=view&amp;id=180867178
"Trump Iranian missile claim unsupported by US intelligence, say sources",,CNA,2026-02-27 06:05 AM,https://www.channelnewsasia.com/world/trump-iranian-missile-claim-unsupported-us-intelligence-say-sources-5957591
UK withdraws staff from Iran over threat of US airstrikes,Christopher McKeon,Independent.ie,2026-02-27 03:24 PM,https://www.independent.ie/world-news/middle-east/uk-withdraws-staff-from-iran-over-threat-of-us-airstrikes/a1605604610.html
