Headline,Author,Source,Published Date,News Url
Two Israeli leftists injured in clashes with masked Israelis near Shechem,Israel National News,Israelnationalnews.com,2026-02-27 02:02 PM,https://www.israelnationalnews.com/news/423093
Trump moves more military might to the Middle East as Iran fails to make deal ahead of key deadline,"Steven Nelson, Caitlin Doornbos, Samuel Chamberlain",New York Post,2026-02-27 12:25 AM,https://nypost.com/2026/02/26/us-news/trump-moves-more-military-might-to-the-middle-east-as-iran-fails-to-make-a-deal/
"Israel primed to invade Gaza again if Hamas doesn’t abide by Trump’s peace plan, ambassador says",Katherine Donlevy,New York Post,2026-02-27 10:39 PM,https://nypost.com/2026/02/27/world-news/israel-will-re-invade-gaza-if-hamas-doesnt-abide-by-trumps-peace-plan/
US allows non-emergency staff to leave Israel as Trump threatens Iran strikes,AFP,TheJournal.ie,2026-02-27 02:55 PM,https://www.thejournal.ie/us-allows-non-emergency-staff-to-leave-israel-as-trump-threatens-iran-strikes-6969749-Feb2026/
Ana Kasparian Offers Zero Apology After ‘Goyim’ Post Trashed as Antisemitic: ‘Call Me Whatever You Want’,Zachary Leeman,Mediaite,2026-02-27 02:49 PM,https://www.mediaite.com/media/news/ana-kasparian-offers-zero-apology-after-goyim-post-trashed-as-antisemitic-call-me-whatever-you-want/
Dan Bongino goes on swear-laden rampage over MAGA divisions: 'Count me out',Ewan Gleadow,Raw Story,2026-02-27 03:11 PM,https://www.rawstory.com/dan-bongino-2675352733/
Brad Lander Is Building a United Progressive Front,James Baratta and Emma Janssen,The American Prospect,2026-02-27 10:15 AM,http://prospect.org/2026/02/27/brad-lander-building-united-progressive-front-congress-new-york/
"US allows some embassy staff to leave Israel, citing safety risks",Reuters,New York Post,2026-02-27 11:21 AM,https://nypost.com/2026/02/27/us-news/us-allows-some-embassy-staff-to-leave-israel-citing-safety-risks/
"Series Mania Unveils Co-Pro Pitching Sessions Competitors Chasing $60,000 Prize",Jesse Whittock,Deadline,2026-02-27 03:44 PM,http://deadline.com/2026/02/series-mania-co-pro-pitching-sessions-line-up-2-1236738553/
Now We Wait For War With Iran To Begin As A Rare 6 Planet Parade And A Blood Moon Eclipse Loom,Michael,Theeconomiccollapseblog.com,2026-02-27 12:42 AM,http://theeconomiccollapseblog.com/now-we-wait-for-war-with-iran-to-begin-as-a-rare-6-planet-parade-and-a-blood-moon-eclipse-loom/
'Peace is within reach': Omani FM optimistic after meeting US VP JD Vance,Israel National News,Israelnationalnews.com,2026-02-27 09:24 PM,https://www.israelnationalnews.com/news/423099
Singapore must retain ability to say 'no' even if it means paying a price: Vivian Balakrishnan,,CNA,2026-02-27 05:12 AM,https://www.channelnewsasia.com/singapore/singapore-must-say-no-pay-price-world-stage-foreign-affairs-vivian-balakrishnan-5957276
Hegseth Pronounces ‘Weakness’ and ‘Wokeness’ Dead in US Military,Virginia Allen,Daily Signal,2026-02-27 11:40 PM,https://www.dailysignal.com/2026/02/27/hegseth-pronounces-weakness-and-wokeness-dead-in-us-military/
Eurovision Song Contest to enforce strict security in Vienna,Elad Benari,Israelnationalnews.com,2026-02-27 03:25 AM,https://www.israelnationalnews.com/news/423065
Syria gov’t swap dozens of detainees with Druze factions,hurriyetdailynews.com,Hurriyet Daily News,2026-02-27 10:40 AM,https://www.hurriyetdailynews.com/syria-govt-swap-dozens-of-detainees-with-druze-factions-219385
"US advises embassy staff in Israel to leave now if they want, as risk of war hangs over Middle East","SAM MEDNICK Associated Press, SAM METZ Associated Press",Abcnews.com,2026-02-27 12:37 PM,https://abcnews.com/International/wireStory/us-advises-embassy-staff-israel-leave-now-risk-130558302
"Iran blocking nuclear watchdog from sites hit by US, Israel: report",Katherine Donlevy,New York Post,2026-02-27 05:35 PM,https://nypost.com/2026/02/27/world-news/iran-blocking-nuclear-watchdog-from-sites-hit-by-us-israel-report/
IAEA report highlights lack of access to Iran's nuclear sites after war,Israel National News,Israelnationalnews.com,2026-02-27 08:15 PM,https://www.israelnationalnews.com/news/423097
French Hard Left Presidential Candidate Melenchon Triggers Antisemitism Row With Epstein Joke,Breitbart London,Breitbart News,2026-02-27 12:41 PM,https://www.breitbart.com/europe/2026/02/27/french-hard-left-presidential-candidate-melenchon-triggers-antisemitism-row-with-epstein-joke/
Allies walking on eggshells: Modi’s Israel visit was a calculated risk to do nothing bold,Kingshuk Chatterjee,The Times of India,2026-02-27 05:55 PM,https://economictimes.indiatimes.com/opinion/et-commentary/allies-walking-on-eggshells-modis-israel-visit-was-a-calculated-risk-to-do-nothing-bold/articleshow/128861373.cms
"Trump says he's ""not happy"" with progress in Iran negotiations",Melissa  Quinn,CBS News,2026-02-27 06:50 PM,https://www.cbsnews.com/news/trump-iran-negotiations-not-happy/
"Chair's Summary of the Outcome Of The Emergency Open-Ended Meeting of the Executive Committee of the Organization of Islamic Cooperation (OIC) at the level of Foreign Ministers, held on February 26, 2026.",John Pike,Globalsecurity.org,2026-02-27 10:11 AM,https://www.globalsecurity.org/military/library/news/2026/02/mil-260226-oic02.htm
Report: Trump briefed on military options in Iran amid talks,Israel National News,Israelnationalnews.com,2026-02-27 01:08 AM,https://www.israelnationalnews.com/news/423062
Parashat Zachor,Rabbi Ilai Grunwald,Israelnationalnews.com,2026-02-27 06:08 AM,https://www.israelnationalnews.com/news/423076
Obicetrapib in patients with heterozygous familial hypercholesterolemia: the BROOKLYN randomized clinical trial,"Stephen J. Nicholls, Adam J. Nelson, Marc Ditmarsch, John J. P. Kastelein, Christie M. Ballantyne, Kausik K. Ray, Ann Marie Navar, Steven E. Nissen, Anne C. Goldberg, Liam R. Brunham, Erin Wuerdeman, Annie L. Neild, Douglas Kling, Andrew Hsieh, Julie Butters, Brian A. Ference, Ulrich Laufs, Maciej Banach, Roxana Mehran, Alberico L. Catapano, Michael Szarek, Violeta Balinskaite, Michael H. Davidson",Nature.com,2026-02-27 12:00 AM,https://www.nature.com/articles/s41591-025-04179-4
Trump: Iran is ‘not going far enough’ in nuclear negotiations,"Elad Benari, Canada",Israelnationalnews.com,2026-02-27 09:39 PM,https://www.israelnationalnews.com/news/423100
COMMUNIQUE ADOPTED BY THE EMERGENCY OPEN-ENDED MEETING OF THE EXECUTIVE COMMITTEE,John Pike,Globalsecurity.org,2026-02-27 10:11 AM,https://www.globalsecurity.org/military/library/news/2026/02/mil-260226-oic01.htm
Tucker Carlson Sneaks Into U.S. Military Hangar To Slash The Tires On All The B-2 Bombers,Babylon Bee,Babylonbee.com,2026-02-27 10:41 PM,https://babylonbee.com/news/tucker-carlson-sneaks-into-us-military-hangar-to-slash-the-tires-on-all-the-b-2-bombers
‘It’s turned into something really ugly’: Why fans are boycotting Scream 7,James Greig,Dazed,2026-02-27 03:20 PM,https://www.dazeddigital.com/film-tv/article/69771/1/inside-the-fan-led-boycott-of-scream-7-melissa-barrera-palestine?utm_source=Link&utm_medium=Link&utm_campaign=RSSFeed&utm_term=it-s-turned-into-something-really-ugly-why-fans-are-boycotting-scream-7
‘It’s been turned into something ugly’: Why fans are boycotting Scream 7,James Greig,Dazed,2026-02-27 03:20 PM,https://www.dazeddigital.com/film-tv/article/69771/1/inside-the-fan-led-boycott-of-scream-7-melissa-barrera-palestine?utm_source=Link&utm_medium=Link&utm_campaign=RSSFeed&utm_term=it-s-been-turned-into-something-ugly-why-fans-are-boycotting-scream-7
Family of UN Palestine Expert Francesca Albanese Sues Trump Over Sanctions,Brett Wilkins,Common Dreams,2026-02-27 07:16 PM,https://www.commondreams.org/news/francesca-albanese-family-sues-trump
"Oil prices jump on Iran attack fears, Wall Street slips on AI",,CNA,2026-02-27 09:22 PM,https://www.channelnewsasia.com/world/oil-tech-stocks-trade-us-iran-wall-street-5959646
BREAKING: Hezbollah and Taliban Bombed Overnight!,Joe Hoft,Joehoft.com,2026-02-27 02:30 PM,https://joehoft.com/breaking-hezbollah-taliban-bombed-overnight/
This Month’s (February) Most Popular Articles,Global Research News,Globalresearch.ca,2026-02-27 06:52 AM,https://www.globalresearch.ca/this-months-february-most-popular-articles-2/5917313
"Stock market today: Dow, S&P 500, Nasdaq fall to end volatile month as AI worries buffet markets",Rian Howlett,Yahoo Entertainment,2026-02-27 09:12 PM,https://finance.yahoo.com/news/live/stock-market-today-dow-sp-500-nasdaq-fall-to-end-volatile-month-as-ai-worries-buffet-markets-211239963.html
The Executive Committee of the OIC at the level of Foreign Ministers meets to address the decisions of the Israeli occupation authorities aimed at promoting settlement and annexing the West Bank,John Pike,Globalsecurity.org,2026-02-27 10:11 AM,https://www.globalsecurity.org/military/library/news/2026/02/mil-260226-oic03.htm
Susan Sarandon praises Spain’s stance on Gaza,,Japan Today,2026-02-27 08:56 PM,https://japantoday.com/category/entertainment/susan-sarandon-praises-spain%E2%80%99s-stance-on-gaza
BREAKING: All Signs Indicate “War Is Coming to Iran”,Joe Hoft,Joehoft.com,2026-02-27 03:30 PM,https://joehoft.com/breaking-all-signs-indicate-war-is-coming-iran/
NVIDIA's CEO Jensen Huang to visit Israel in April,BY ASSAF GILEAD/GLOBES/TNS,The Jerusalem Post,2026-02-27 04:09 PM,https://www.jpost.com/business-and-innovation/all-news/article-888223
Why are U.S. staff told to leave Israel? #world,AllToc,Alltoc.com,2026-02-27 03:12 PM,https://alltoc.com/world/why-are-u-s-staff-told-to-leave-israel
Why is the U.S. authorizing departures from Israel? #world,AllToc,Alltoc.com,2026-02-27 06:14 PM,https://alltoc.com/world/why-is-the-u-s-authorizing-departures-from-israel
Iran agrees in breakthrough talks not to stockpile enriched uranium that could build bombs,AFP,TheJournal.ie,2026-02-27 10:13 PM,https://www.thejournal.ie/iran-agrees-in-breakthrough-talks-not-to-stockpile-enriched-uranium-that-could-build-bombs-6970304-Feb2026/
Israelis weary but prepared for possible Iran strikes,,CNA,2026-02-27 05:33 PM,https://www.channelnewsasia.com/world/iran-us-israel-strikes-war-trump-5959321
BREAKING: 15 Countries Tell Citizens to Get Out of Iran Now – Explosions Reported Outside Tehran,Joe Hoft,Joehoft.com,2026-02-27 08:00 PM,https://joehoft.com/breaking-15-countries-tell-citizens-get-iran-now/
Emunah visits her fallen soldier husband’s grave with her son born after his death,Israel National News,Israelnationalnews.com,2026-02-27 05:48 AM,https://www.israelnationalnews.com/news/423073
Tether says it has frozen $4.2 billion of its stablecoin over crime links,,CNA,2026-02-27 12:10 PM,https://www.channelnewsasia.com/business/tether-says-it-has-frozen-42-billion-its-stablecoin-over-crime-links-5958591
UK diplomatic staff withdrawn from Iran as US considers strike,Esther Webber,POLITICO.eu,2026-02-27 04:42 PM,https://www.politico.eu/article/uk-diplomatic-staff-withdrawn-from-iran-as-us-considers-strike/
Syria’s power shift: consolidation without trust,Stephen M. Flatow,Israelnationalnews.com,2026-02-27 08:09 AM,https://www.israelnationalnews.com/news/423082
Taxi ad fighting antisemitism removed for taking swipe at Mamdani’s free NYC bus plan,Carl Campanile,New York Post,2026-02-27 01:42 AM,https://nypost.com/2026/02/26/us-news/taxi-ad-fighting-antisemitism-removed-for-taking-swipe-at-mamdanis-free-nyc-bus-plan/
Not Just Another “Vanilla” Archaeological Find,Troy Lacey,Answersingenesis.org,2026-02-27 11:00 AM,https://answersingenesis.org/archaeology/not-just-another-vanilla-archaeological-find/
"Full Transcript: Key mediator in U.S.-Iran talks says ""deal is within our reach""",,CBS News,2026-02-27 09:14 PM,https://www.cbsnews.com/news/full-transcript-omani-foreign-minister-badr-albusaidi/
Jesse Jackson Reshaped the Democratic Party,Richard Kreitner,Thenation.com,2026-02-27 05:45 PM,https://www.thenation.com/article/politics/jesse-jackson-reshaped-the-democratic-party/
Gaza civil defense says Israeli strikes kill at least 5,hurriyetdailynews.com,Hurriyet Daily News,2026-02-27 06:22 AM,https://www.hurriyetdailynews.com/gaza-civil-defense-says-israeli-strikes-kill-at-least-5-219371
Construction Financing Complete for 347-MW Texas Solar Power Project,Darrell Proctor,POWER magazine,2026-02-27 03:35 PM,https://www.powermag.com/construction-financing-complete-for-347-mw-texas-solar-power-project/
President Herzog speaks with President Zelenskyy of Ukraine,John Pike,Globalsecurity.org,2026-02-27 10:24 AM,https://www.globalsecurity.org/wmd/library/news/ukraine/2026/02/ukraine-260226-israel-mfa01.htm
India and Israel pledge to boost ties in defence and technology,,BBC News,2026-02-27 07:53 AM,https://www.bbc.com/news/articles/cly14vppym2o
Israeli army chief privately warns of cost of new war with Iran: Report,John Pike,Globalsecurity.org,2026-02-27 10:11 AM,https://www.globalsecurity.org/wmd/library/news/israel/2026/02/israel-260226-presstv01.htm
"France: Swastikas found in Drancy, former WWII transit camp for Jews",Israel National News,Israelnationalnews.com,2026-02-27 03:52 AM,https://www.israelnationalnews.com/news/423066
"Palestine: UN rights chief highlights suffering, atrocity crimes 'that remain unpunished'",John Pike,Globalsecurity.org,2026-02-27 10:11 AM,https://www.globalsecurity.org/military/library/news/2026/02/mil-260226-unnews01.htm
Purim and the importance of wonder,Irene Lancaster,Christiantoday.com,2026-02-27 06:05 AM,https://www.christiantoday.com/news/purim-and-the-importance-of-wonder
“Not ready for prime time”: A federal tool to check voter citizenship keeps making mistakes,"Jen Fifield, Zach Despart",Salon,2026-02-27 11:00 AM,https://www.salon.com/2026/02/27/not-ready-for-prime-time-a-federal-tool-to-check-voter-citizenship-keeps-making-mistakes-partner/
Somebody Turn the Lights On,Bilge Ebiri,Vulture,2026-02-27 05:54 PM,http://www.vulture.com/article/scream-7-review-nothing-matters-and-everything-sucks.html
"Missing DOJ Files: As Clintons Testify About Epstein, Where Are FBI Interviews with Trump Accuser?",webdev@democracynow.org (Democracy Now!),Democracy Now!,2026-02-27 01:12 PM,https://www.democracynow.org/2026/2/27/jeffrey_epstein_and_ghislaine_maxwell
 Watch the Austrian Bundesliga live on OneFootball ,OneFootball,Onefootball.com,2026-02-27 04:02 PM,https://onefootball.com/en/news/watch-the-austrian-bundesliga-live-on-onefootball-42477157
"New Israeli poll shows young Jewish voters most right-wing, fanatically religious, and pro-genocide in Israeli history",Jonathan Ofir,Mondoweiss,2026-02-27 04:40 PM,https://mondoweiss.net/2026/02/new-israeli-poll-shows-young-jewish-voters-most-right-wing-fanatically-religious-and-pro-genocide-in-israeli-history/
JFK’s Letter on His 1939 Visit to Palestine,Renee Parsons,Globalresearch.ca,2026-02-27 10:40 AM,https://www.globalresearch.ca/jfks-letter-1939-visit-palestine/5917298
What to Do When You Have Nothing Left: The God Who Makes Much of Little,Ann Voskamp,Annvoskamp.com,2026-02-27 05:53 PM,https://annvoskamp.com/2026/02/what-to-do-when-you-have-nothing-left-the-god-who-makes-much-of-little/
Picture of 'rare' boot released as police try to identify woman's body,,Sky.com,2026-02-27 03:45 PM,https://news.sky.com/story/picture-of-rare-boot-released-as-police-try-to-identify-womans-body-found-off-iona-coast-13513027
Tehran Has Discovered Moscow Is a Fair-Weather Friend,Alex Vatanka,Foreign Policy,2026-02-27 05:01 AM,http://foreignpolicy.com/2026/02/27/iran-russia-threats-strategic-alignment/
The Iranians Offered a Good Deal. Here’s Why Trump Might Not Take It.,Fred Kaplan,Slate Magazine,2026-02-27 06:50 PM,https://slate.com/news-and-politics/2026/02/trump-iran-nuclear-talks-war.html
Why Iran’s missiles matter more than Its enrichment level,Dr. Avi Perry,Israelnationalnews.com,2026-02-27 09:00 AM,https://www.israelnationalnews.com/news/423081
Female combat veteran: Enlistment equality endangers women,Israel National News,Israelnationalnews.com,2026-02-27 02:12 PM,https://www.israelnationalnews.com/news/423092
"German Police Rescue $340,000 Painting From A Dumpster After It Was Mistakenly Left At An Airport",Natasha Ishak,Allthatsinteresting.com,2026-02-27 07:00 PM,https://allthatsinteresting.com/dusseldorf-germany-yves-tanguy-painting
U.S. Advises Embassy Staff In Israel To Leave Now If They Want Amid Risk Of War With Iran,HuffPost,HuffPost,2026-02-27 12:35 PM,https://www.huffpost.com/entry/us-tells-israel-embassy-staff-to-leave-if-they-want_n_69a18d22e4b0302539934adc
"For First Time, Gallup Poll Shows Americans Sympathize More With Palestinians Than With Israelis",Jake Johnson,Common Dreams,2026-02-27 02:24 PM,https://www.commondreams.org/news/gallup-palestinians-israelis
Hillary Clinton Knows Nothing,Peter Suderman,Reason,2026-02-27 02:29 PM,https://reason.com/2026/02/27/hillary-clinton-knows-nothing/
Minister leaves door open to tabling new police search powers bill after 1st attempt faced backlash,,CBC News,2026-02-27 10:31 PM,https://www.cbc.ca/news/politics/anandasangaree-lawful-access-legislation-9.7108630
Escalation of this War Could Shatter Iran into Ethnic Enclaves,Zoltan Grossman,CounterPunch,2026-02-27 07:16 AM,https://www.counterpunch.org/2026/02/27/escalation-of-this-war-could-shatter-iran-into-ethnic-enclaves/
TOI Uttarakhand Transformation Dialogue 2026: How AI-led strategies can shape state’s infra and education growth,TIMESOFINDIA.COM,The Times of India,2026-02-27 04:40 PM,https://timesofindia.indiatimes.com/india/toi-uttarakhand-transformation-dialogue-2026-how-ai-led-strategies-can-shape-states-infra-and-education-growth/articleshow/128858745.cms
"U.S. allows some embassy staff to leave Israel, citing safety risks amid Iran threats","Reuters, Andrea Mitchell, Natasha Lebedeva",NBC News,2026-02-27 10:13 AM,https://www.nbcnews.com/world/iran/us-allows-embassy-staff-leave-israel-citing-safety-risks-iran-threats-rcna260929
"California Sued Over ‘Jew-Free’ Classrooms, Unchecked Antisemitism in Landmark Litigation",Jane Coleman,Legalinsurrection.com,2026-02-27 02:00 PM,https://legalinsurrection.com/2026/02/california-sued-over-jew-free-classrooms-unchecked-antisemitism-in-landmark-litigation/
Iran Armed Forces warn US: 'Any unwise action will ignite a widespread fire' in West Asia,John Pike,Globalsecurity.org,2026-02-27 10:24 AM,https://www.globalsecurity.org/wmd/library/news/iran/2026/02/iran-260226-presstv01.htm
‘Great to see how he…’: Watch how Fauda star Lior Raz reacted after meeting PM Narendra Modi in Israel,Trending Desk,The Times of India,2026-02-27 03:29 AM,https://economictimes.indiatimes.com/news/new-updates/great-to-see-how-he-watch-how-fauda-star-lior-raz-reacted-after-meeting-pm-narendra-modi/articleshow/128835871.cms
The American Universities Programming Israel’s Killer Drones,Julian Cooper,Thenation.com,2026-02-27 10:00 AM,https://www.thenation.com/?post_type=article&p=588438
Countries warn citizens against travel to Israel and Iran amid rising tensions,,Israelnationalnews.com,2026-02-27 07:32 PM,https://www.israelnationalnews.com/flashes/677169
OPKO Health Q4 Earnings Call Highlights,MarketBeat,MarketBeat,2026-02-27 06:12 AM,https://www.marketbeat.com/instant-alerts/opko-health-q4-earnings-call-highlights-2026-02-27/?utm_source=yahoofinance&amp;utm_medium=yahoofinance
Jewish parents across California sue state over antisemitism,Gary Willig,Israelnationalnews.com,2026-02-27 07:15 AM,https://www.israelnationalnews.com/news/423079
UN nuclear watchdog says it’s unable to verify whether Iran has suspended all uranium enrichment,Associated Press,Boston Herald,2026-02-27 02:10 PM,https://www.bostonherald.com/2026/02/27/un-iran-uranium-enrichment/
Suspect arrested after London Churchill statue defaced with pro-Palestinian graffiti,The Associated Press,Abcnews.com,2026-02-27 01:07 PM,https://abcnews.com/International/wireStory/suspect-arrested-after-churchill-statue-london-defaced-pro-130558873
NurExone to Showcase Its Regenerative Medicine Platform at NANO.IL.2026 and Advanced Therapies Congress in March 2026 and Provides Corporate Update,NurExone Biologic Inc,GlobeNewswire,2026-02-27 09:03 PM,https://www.globenewswire.com/news-release/2026/02/27/3246788/0/en/NurExone-to-Showcase-Its-Regenerative-Medicine-Platform-at-NANO-IL-2026-and-Advanced-Therapies-Congress-in-March-2026-and-Provides-Corporate-Update.html
Report: Newcastle United considering move to sign 21-year-old forward,EPL Index,English Premier League Index - Opta Stats,2026-02-27 01:50 PM,https://eplindex.com/143327/report-newcastle-united-considering-move-to-sign-21-year-old-forward.html
The Kyle Anzalone Show [GUEST] Dave DeCamp: BREAKING: Tucker Carlson detained in ISRAEL! – Trump’s Iran Strategy Exposed!,Kyle Anzalone,Antiwar.com,2026-02-27 04:54 PM,https://www.antiwar.com/blog/2026/02/27/the-kyle-anzalone-show-guest-dave-decamp-breaking-tucker-carlson-detained-in-israel-trumps-iran-strategy-exposed/
"10 Epstein files conspiracy theories, debunked","Emma  Li, Layla  Ferris, Christina  Capatides",CBS News,2026-02-27 11:11 PM,https://www.cbsnews.com/news/jeffrey-epstein-conspiracy-theories/
US authorises the departure of some embassy personnel from Israel due to safety risks,Reuters,The Times of India,2026-02-27 09:35 AM,https://economictimes.indiatimes.com/news/international/world-news/us-begins-partial-embassy-evacuation-in-israel-cites-rising-safety-risks/articleshow/128843371.cms
"Chinese Embassy in Israel advises Chinese nationals to monitor security, avoid unnecessary outings",Global Times,Freerepublic.com,2026-02-27 04:52 PM,https://freerepublic.com/focus/f-news/4368547/posts
"PUNCH journalist, seven others for Lagos urban reporting project",Punch Newspapers,The Punch,2026-02-27 01:04 PM,https://punchng.com/punch-journalist-seven-others-for-lagos-urban-reporting-project/
Mideast tensions rise as Iran-US nuclear talks fail to produce agreement,AP- PTI,BusinessLine,2026-02-27 01:12 AM,https://www.thehindubusinessline.com/news/world/mideast-tensions-rise-as-iran-us-nuclear-talks-fail-to-produce-agreement/article70682403.ece
"Crypto taxes updated, BTC stuck below $70K: Month in charts",Cointelegraph by Aaron Wood,Cointelegraph,2026-02-27 03:09 PM,https://cointelegraph.com/news/crypto-taxes-btc-stuck-70k-month-in-charts
The Gorton and Denton by-election and the alarming rise of sectarianism in British politics,Lynda Rose,Christiantoday.com,2026-02-27 01:35 PM,https://www.christiantoday.com/news/the-gorton-and-denton-by-election-and-the-alarming-rise-of-sectarianism-in-british-politics
The Right-Wing Nonprofit Serving A.I. Slop for America’s Birthday,Jessica Winter,The New Yorker,2026-02-27 11:00 AM,https://www.newyorker.com/news/the-lede/the-right-wing-nonprofit-serving-ai-slop-for-americas-birthday
PM Modi first leader to cross 100m followers on Instagram,TNN,The Times of India,2026-02-27 12:50 AM,https://timesofindia.indiatimes.com/india/pm-modi-first-leader-to-cross-100m-followers-on-instagram/articleshow/128833633.cms
Breaking News Live Updates: India-Israel ties get fresh momentum; Vikram Misri hails ‘incredibly rich’ visit as PM Modi returns to Delhi,Economic Times,Economictimes.com,2026-02-27 02:08 AM,https://m.economictimes.com/news/newsblogs/pm-modi-india-us-iran-talks-russia-ukraine-war-netflix-paramount-warner-bros-bid-rahul-gandhi-foreign-trade-fiscal-deficit/liveblog/128834717.cms
SC bans NCERT book over ‘judicial corruption’ chapter,Dhananjay Mahapatra,The Times of India,2026-02-27 12:07 AM,https://timesofindia.indiatimes.com/india/sc-bans-ncert-book-over-judicial-corruption-chapter/articleshow/128833065.cms
"NCERT book row: Have great respect for judiciary, says BJP",TNN,The Times of India,2026-02-27 12:48 AM,https://timesofindia.indiatimes.com/india/ncert-book-row-have-great-respect-for-judiciary-says-bjp/articleshow/128833600.cms
ED gets sanction to prosecute P Chidambaram; laundering probe based on FIRs by CBI,TNN,The Times of India,2026-02-27 12:20 AM,https://timesofindia.indiatimes.com/city/delhi/ed-to-court-got-sanction-to-prosecute-chidambaram/articleshow/128833052.cms
"Voltaire, International Newsletter N°164",Voltaire Network,Red Voltaire,2026-02-27 11:03 AM,https://www.voltairenet.org/article223783.html
From Iron Dome to Iron Beam: Israel’s sky shields against Iranian missiles,Reuters,The Times of India,2026-02-27 10:25 AM,https://economictimes.indiatimes.com/news/defence/israels-iron-dome-to-iron-beam-inside-the-multi-layer-sky-shield-defending-against-iranian-missiles/articleshow/128844223.cms
Israeli court allows aid groups to keep working in Gaza,RTÉ News,RTE,2026-02-27 03:19 PM,https://www.rte.ie/news/2026/0227/1560823-israel-gaza-aid/
Israeli fire kills eight people in Gaza as truce deal staggers,Reuters,The Times of India,2026-02-27 02:18 AM,https://economictimes.indiatimes.com/news/defence/israeli-fire-kills-eight-people-in-gaza-as-truce-deal-staggers/articleshow/128834876.cms
Iconic Churchill Statue Vandalized: 'ZIONIST WAR CRIMINAL'...,newsweek,Newsweek,2026-02-27 04:00 PM,https://www.newsweek.com/winston-churchill-statue-london-vandalized-zionist-war-criminal-11591349
Antonio Blakeney Reportedly 'Co-Conspirator 1’ in NBA Gambling Scandal Indictment,Brad Senkiw,Covers.com,2026-02-27 12:29 AM,https://www.covers.com/industry/antonio-blakeney-reportedly-co-conspirator-1-in-nba-gambling-scandal-indictment
The D Brief: Anthropic says no to DOD; Afghanistan-Pakistan war; Ukraine tactics update; US laser downs DHS drone; And a bit more.,Ben Watson and Bradley Peniston,Defense One,2026-02-27 04:36 PM,https://www.defenseone.com/threats/2026/02/the-d-brief-february-27-2026/411756/
"Iran-U.S. Geneva talks show diplomacy keeps door ajar, but key differences still unresolved",John Pike,Globalsecurity.org,2026-02-27 10:11 AM,https://www.globalsecurity.org/wmd/library/news/iran/2026/02/iran-260227-pdo01.htm
