Headline,Author,Source,Published Date,News Url
State Dept authorizes non-essential US Embassy personnel in Jerusalem to depart ahead of possible Iran strikes,,Fox News,2026-02-27 01:04 PM,https://www.foxnews.com/world/state-dept-authorizes-non-essential-us-embassy-personnel-jerusalem-depart-ahead-possible-iran-strikes
Biggest victim of the Epstein feeding-frenzy? The truth,Isaac Schorr,New York Post,2026-02-27 11:23 PM,https://nypost.com/2026/02/27/opinion/biggest-victim-of-the-epstein-feeding-frenzy-the-truth/
ScarCruft Uses Zoho WorkDrive and USB Malware to Breach Air-Gapped Networks,info@thehackernews.com (The Hacker News),Internet,2026-02-27 12:43 PM,https://thehackernews.com/2026/02/scarcruft-uses-zoho-workdrive-and-usb.html
US urges its citizens to leave Israel immediately amid strike threat to Iran - The Guardian,feedfeeder,Slashdot.org,2026-02-27 05:52 PM,https://slashdot.org/firehose.pl?op=view&amp;id=180868754
"Rubio to travel to Israel to discuss Iran, other issues, State Dept. says - CNBC",feedfeeder,Slashdot.org,2026-02-27 08:12 PM,https://slashdot.org/firehose.pl?op=view&amp;id=180869516
"Iranian Kurdish groups unite against Tehran regime, Iraqi militias threaten Kurdistan Region",Seth Frantzman,Longwarjournal.org,2026-02-27 04:15 PM,https://www.longwarjournal.org/archives/2026/02/iranian-kurdish-groups-unite-against-tehran-regime-as-iraqi-militias-threaten-kurdistan-region.php
Marco Rubio orders US officials to stop commentary that could strain Iran talks - The Guardian,feedfeeder,Slashdot.org,2026-02-27 08:52 PM,https://slashdot.org/firehose.pl?op=view&amp;id=180869768
Bohemians go three clear at Premier Division summit with derby win over Shamrock Rovers,Gavin Cummiskey,The Irish Times,2026-02-27 10:26 PM,https://www.irishtimes.com/sport/soccer/2026/02/27/bohemians-go-three-clear-at-premier-division-summit-with-derby-win-over-shamrock-rovers/
Scream 7 premiere crashed by pro-Palestine protesters two years after Melissa Barrera’s firing,Imogene Bedford,New Zealand Herald,2026-02-27 12:04 AM,https://www.nzherald.co.nz/entertainment/scream-7-premiere-crashed-by-pro-palestine-protesters-two-years-after-melissa-barreras-firing/5WTNRHJVWBAYPLHUZEFKM4CKLQ/
Churchill Statue Defaced With Graffiti in London,John Johnson with Newser.AI,Newser,2026-02-27 04:22 PM,https://www.newser.com/story/384507/churchill-statue-defaced-with-graffiti-in-london.html
CNN poll on Trump SOTU bodes poorly for Democrats,The Blaze,Freerepublic.com,2026-02-27 02:23 PM,https://freerepublic.com/focus/f-bloggers/4368524/posts
Family of U.N. Expert Critical of Israel Sues Trump Over Sanctions - The New York Times - The New York Times,feedfeeder,Slashdot.org,2026-02-27 07:12 AM,https://slashdot.org/firehose.pl?op=view&amp;id=180866682
Gaza: Armed terrorists who emerged from terror tunnel eliminated,Israel National News,Israelnationalnews.com,2026-02-27 11:45 AM,https://www.israelnationalnews.com/news/423088
US and Iran hold talks seen as crucial to prevent conflict,admin,Thechronicle.com.gh,2026-02-27 06:21 AM,https://thechronicle.com.gh/us-and-iran-hold-talks-seen-as-crucial-to-prevent-conflict/
"ORYZON Reports Financial Results and Corporate Update for Quarter Ended December 31st, 2025","Oryzon Genomics, S.A.",GlobeNewswire,2026-02-27 05:29 PM,https://www.globenewswire.com/news-release/2026/02/27/3246699/0/en/ORYZON-Reports-Financial-Results-and-Corporate-Update-for-Quarter-Ended-December-31st-2025.html
Oil Market Is Nervous for the Coming Weekend,Andreas Exarheas,Rigzone,2026-02-27 11:37 AM,https://www.rigzone.com/news/oil_market_is_nervous_for_the_coming_weekend-27-feb-2026-183087-article/
US embassy in Israel says non-emergency staff can leave the country,Bbc News,BBC News,2026-02-27 02:32 PM,https://www.bbc.com/news/articles/c309vz0z893o
Is Europe a Possessed Continent?,Peter Isackson,Fair Observer,2026-02-27 02:20 PM,https://www.fairobserver.com/politics/is-europe-a-possessed-continent/
Israeli court temporarily blocks ban on NGOs operating in Gaza,Rami Rayyub,Independent.ie,2026-02-27 03:34 PM,https://www.independent.ie/world-news/middle-east/israeli-court-temporarily-blocks-ban-on-ngos-operating-in-gaza/a574493752.html
"Stripwire On Kickstarter – The New ""Cancelled"" Comics Cavalcade",Rich Johnston,Bleeding Cool News,2026-02-27 02:00 PM,https://bleedingcool.com/comics/stripwire-on-kickstarter-the-new-cancelled-comics-cavalcade/
Rubio plans to visit Israel next week as US-Iran tensions remain high after latest talks - AP News,feedfeeder,Slashdot.org,2026-02-27 06:53 PM,https://slashdot.org/firehose.pl?op=view&amp;id=180868946
Top U.S. commander in the Middle East briefs Trump on Iran options - Axios,feedfeeder,Slashdot.org,2026-02-27 07:13 AM,https://slashdot.org/firehose.pl?op=view&amp;id=180866690
U.S. Readies First ‘One‑Way’ Kamikaze Drones as Iran Talks End with No Deal,Joshua Klein,Breitbart News,2026-02-27 02:38 AM,https://www.breitbart.com/politics/2026/02/26/u-s-readies-first-oneway-kamikaze-drone-iran-talks-stall/
US urges its citizens to leave Israel immediately amid strike threat on Iran,Patrick Wintour,The Irish Times,2026-02-27 02:16 PM,https://www.irishtimes.com/world/middle-east/2026/02/27/us-urges-its-citizens-to-leave-israel-immediately-amid-strike-threat-on-iran/
"Old/New Testament Reading for Friday February 27, 2026 (KJV)",,Biblegateway.com,2026-02-27 05:00 AM,https://www.biblegateway.com/reading-plans/old-new-testament/2026/02/27/
UN Human Rights Council chief cuts off speaker criticizing US-sanctioned official,,Fox News,2026-02-27 10:39 PM,https://www.foxnews.com/world/un-human-rights-council-chief-cuts-off-speaker-criticizing-us-sanctioned-official
Watch: A white morning on Mt. Hermon,Israel National News,Israelnationalnews.com,2026-02-27 09:27 AM,https://www.israelnationalnews.com/news/423083
UN nuclear watchdog says it’s unable to verify whether Iran has suspended all uranium enrichment,The Associated Press,The Denver Post,2026-02-27 02:10 PM,https://www.denverpost.com/2026/02/27/un-iran-uranium-enrichment/
"Dedicated to my soul brother, Adel El-Badrawi Killed in 1988, holding his camera in the Iran–Iraq War.",نصر القوصي,Ahram-canada.com,2026-02-27 07:49 AM,https://www.ahram-canada.com/239372/
Former Israeli prime minister argues Iran is trying to 'buy time' with Geneva talks,,Fox News,2026-02-27 01:03 AM,https://www.foxnews.com/media/former-israeli-prime-minister-argues-iran-trying-buy-time-geneva-talks
Watch: US Embassy begins service in Efrat for the first time ever,Israel National News,Israelnationalnews.com,2026-02-27 08:09 AM,https://www.israelnationalnews.com/news/423080
"Columbia Student Detained by ICE, Then Abruptly Released",Evann Gastaldo,Newser,2026-02-27 08:00 AM,https://www.newser.com/story/384491/columbia-student-detained-by-ice-then-abruptly-released.html
"Julie Swidler, Jeff Harleston & Paul Robinson To Be Honored in N.Y.",Paul Grein,Billboard,2026-02-27 08:07 PM,http://www.billboard.com/pro/2026-uja-federation-of-new-york-honorees-named/
Box Office: Scream 7 Makes $7.8 Million in Previews,Jordan Moreau,Variety,2026-02-27 03:21 PM,https://variety.com/2026/film/box-office/scream-7-box-office-previews-1236673975/
On the Lot: The deal Hollywood fears most,Rebecca Keegan,NBC News,2026-02-27 08:29 PM,https://www.nbcnews.com/pop-culture/pop-culture-news/on-the-lot-newsletter-hollywood-ellison-era-warner-bros-discovery-rcna261022
"Chronological Reading for Friday February 27, 2026 (NIV)",,Biblegateway.com,2026-02-27 05:00 AM,https://www.biblegateway.com/reading-plans/chronological/2026/02/27/
Nolte: Anti-Jew Protesters Fail as ‘Scream 7’ Opens to Franchise Record,John Nolte,Breitbart News,2026-02-27 03:52 PM,https://www.breitbart.com/entertainment/2026/02/27/nolte-anti-jew-protesters-fail-as-scream-7-opens-to-franchise-record/
Canadian Music Industry Reaches 'Tipping Point' for Mental Health,Heather Taylor-singh,Billboard,2026-02-27 07:53 PM,http://www.billboard.com/pro/canadian-music-industry-mental-health-crisis/
"Old/New Testament Reading for Friday February 27, 2026 (NIV)",,Biblegateway.com,2026-02-27 05:00 AM,https://www.biblegateway.com/reading-plans/old-new-testament/2026/02/27/
MediaHuman YouTube Downloader 3.9.18 (2602),Ash,Rlsbb.to,2026-02-27 07:45 AM,https://post.rlsbb.to/mediahuman-youtube-downloader-3-9-18-2602/
Letters: This country still has a lot of work to do for survivors of institutional abuse,Letters to the editor,Independent.ie,2026-02-27 05:30 AM,https://www.independent.ie/opinion/letters/letters-this-country-still-has-a-lot-of-work-to-do-for-survivors-of-institutional-abuse/a1237350965.html
Where Iran’s ballistic missiles can reach — and how close they are to the US,,Fox News,2026-02-27 12:07 PM,https://www.foxnews.com/politics/where-irans-ballistic-missiles-can-reach-how-close-us
Box Office: 'Scream 7' Scares Up Record Previews,Pamela Mcclintock,Hollywood Reporter,2026-02-27 04:59 PM,http://www.hollywoodreporter.com/movies/movie-news/scream-7-box-office-franchise-best-previews-1236517089/
The relationship between platelet count and postoperative acute kidney injury and long-term prognosis in neurosurgical critically ill patients: A retrospective study,"Shu Yang, Shuo Zhang, Guoqing Li, Guowei Zhu, Linfeng Fang, Minmin Zhu",Plos.org,2026-02-27 02:00 PM,https://journals.plos.org/plosone/article?id=10.1371/journal.pone.0343653
Shelbourne see off Drogheda with second-half comeback,Barry Landy,RTE,2026-02-27 10:13 PM,https://www.rte.ie/sport/soccer/2026/0227/1560818-shelbourne-see-off-drogheda-with-second-half-comeback/
Daily Press Briefing by the Office of the Spokesperson for the Secretary-General,United Nations,UN News,2026-02-27 07:03 PM,https://press.un.org/en/2026/db260227.doc.htm
"Adrian Blomfield: Tehran’s hand may be weaker, but it has called Donald Trump’s bluff",Adrian Blomfield,Independent.ie,2026-02-27 05:30 AM,https://www.independent.ie/opinion/comment/adrian-blomfield-tehrans-hand-may-be-weaker-but-it-has-called-donald-trumps-bluff/a295569115.html
Manchester byelection defeat leaves Keir Starmer green around the gills,Mark Paul,The Irish Times,2026-02-27 08:24 AM,https://www.irishtimes.com/world/uk/2026/02/27/manchester-byelection-defeat-leaves-keir-starmer-green-around-the-gills/
"Series Mania Announces Co-Pro Projects Taking on Mysteries, ‘Womanhood Without Shame’ and ‘Wickedly Fun’ Experiences of the Former First Lady of Iceland",Marta Balaga,Variety,2026-02-27 08:00 AM,https://variety.com/2026/tv/global/series-mania-co-pro-pitching-sessions-lineup-1236673934/
